{
  "schema_version": 2,
  "generated_at": "2026-10-25T10:26:25Z",
  "coverage": {
    "sources_read": [
      "/home/dev/home/.claude.json",
      "/home/dev/home/.claude/settings.json",
      "/home/dev/home/.cursor/permissions.json",
      "/home/dev/src/webapp/dashboard/.env.local",
      "/home/dev/src/api-backend/.env.example",
      "/home/dev/src/notes/.env"
    ],
    "sources_failed": [],
    "agents_unsupported": []
  },
  "provenance": {
    "engine_version": "0.1.0-dev",
    "rules_version": "0",
    "knowledge_version": "2026-10-24",
    "host_id": "host_ec7ae90fdb749c2f"
  },
  "nodes": [
    {
      "id": "agent_client_70ecc232d00b77a7",
      "kind": "agent",
      "type": "ai_client",
      "name": "Claude Code",
      "platform": "claude-code",
      "config_path": "/home/dev/home/.claude",
      "discovered_at": "2026-10-25T10:26:25Z"
    },
    {
      "id": "agent_client_764a08829c0ea77d",
      "kind": "agent",
      "type": "ai_client",
      "name": "Cursor",
      "platform": "cursor",
      "config_path": "/home/dev/home/.cursor",
      "discovered_at": "2026-10-25T10:26:25Z"
    },
    {
      "id": "cap_00f1acdc9976dffa",
      "kind": "capability",
      "type": "execute_shell",
      "basis": "configured",
      "in_force": true,
      "approval": "allow",
      "target_scope": "npx tsx *",
      "applies_in": "user",
      "source": "/home/dev/home/.claude/settings.json#/permissions/allow/1",
      "rule": "Bash(npx tsx *)"
    },
    {
      "id": "cap_1542c59c7b5e7e00",
      "kind": "capability",
      "type": "execute_shell",
      "basis": "configured",
      "in_force": true,
      "approval": "allow",
      "target_scope": "git status",
      "applies_in": "user",
      "source": "/home/dev/home/.cursor/permissions.json#/terminalAllowlist/1",
      "rule": "terminalAllowlist:git status"
    },
    {
      "id": "cap_18304d5ced1afd04",
      "kind": "capability",
      "type": "read_files",
      "basis": "product_default",
      "in_force": true,
      "approval": "allow",
      "target_scope": "working_directories",
      "applies_in": "",
      "source": "kb:cursor/file_tools_read@2026-10-25"
    },
    {
      "id": "cap_2a26ede557a8d5f1",
      "kind": "capability",
      "type": "execute_shell",
      "basis": "configured",
      "in_force": true,
      "approval": "allow",
      "target_scope": "npm test",
      "applies_in": "user",
      "source": "/home/dev/home/.cursor/permissions.json#/terminalAllowlist/0",
      "rule": "terminalAllowlist:npm test"
    },
    {
      "id": "cap_2ca9ae8bdf107f20",
      "kind": "capability",
      "type": "network",
      "basis": "product_default",
      "in_force": true,
      "approval": "ask",
      "target_scope": "*",
      "applies_in": "",
      "source": "kb:claude-code/web_default@2026-10-24"
    },
    {
      "id": "cap_2ff79c42411ddc45",
      "kind": "capability",
      "type": "read_files",
      "basis": "product_default",
      "in_force": true,
      "approval": "ask",
      "target_scope": "outside_working_directories",
      "applies_in": "",
      "source": "kb:claude-code/read_outside_working_dirs@2026-10-24"
    },
    {
      "id": "cap_498342e2ae8a6d45",
      "kind": "capability",
      "type": "network",
      "basis": "product_default",
      "in_force": true,
      "approval": "allow",
      "target_scope": "preapproved_documentation_domains",
      "applies_in": "",
      "source": "kb:claude-code/webfetch_preapproved_domains@2026-10-24"
    },
    {
      "id": "cap_4d0ce3d318d84650",
      "kind": "capability",
      "type": "read_files",
      "basis": "product_default",
      "in_force": true,
      "approval": "allow",
      "target_scope": "working_directories",
      "applies_in": "",
      "source": "kb:claude-code/read_in_working_dirs@2026-10-24"
    },
    {
      "id": "cap_4ea37a8a61411289",
      "kind": "capability",
      "type": "execute_shell",
      "basis": "product_default",
      "in_force": true,
      "approval": "allow",
      "target_scope": "builtin_read_only_bash_commands",
      "applies_in": "",
      "source": "kb:claude-code/shell_readonly_bash_commands@2026-10-24"
    },
    {
      "id": "cap_5b00f70e033cd114",
      "kind": "capability",
      "type": "permission_mode",
      "basis": "product_default",
      "in_force": true,
      "approval": "allow",
      "target_scope": "auto",
      "applies_in": "",
      "source": "kb:claude-code/builtin_default_mode@2026-10-24"
    },
    {
      "id": "cap_5feda45241df92a0",
      "kind": "capability",
      "type": "write_files",
      "basis": "product_default",
      "in_force": true,
      "approval": "allow",
      "target_scope": "working_directories",
      "applies_in": "",
      "source": "kb:cursor/file_tools_write_workspace@2026-10-25"
    },
    {
      "id": "cap_722b72b0b536cf58",
      "kind": "capability",
      "type": "read_files",
      "basis": "product_default",
      "in_force": true,
      "approval": "allow",
      "target_scope": "sandbox_read_boundary_system",
      "applies_in": "",
      "source": "kb:cursor/sandbox_defaults@2026-10-25"
    },
    {
      "id": "cap_74fec5fb2aa25663",
      "kind": "capability",
      "type": "execute_shell",
      "basis": "configured",
      "in_force": true,
      "approval": "allow",
      "target_scope": "npm test",
      "applies_in": "user",
      "source": "/home/dev/home/.claude/settings.json#/permissions/allow/0",
      "rule": "Bash(npm test)"
    },
    {
      "id": "cap_7d6fd33560cabd76",
      "kind": "capability",
      "type": "permission_mode",
      "basis": "product_default",
      "in_force": true,
      "approval": "allow",
      "target_scope": "auto_review",
      "applies_in": "",
      "source": "kb:cursor/run_mode_builtin@2026-10-25"
    },
    {
      "id": "cap_b5d39af9dd65cb07",
      "kind": "capability",
      "type": "execute_shell",
      "basis": "product_default",
      "in_force": true,
      "approval": "ask",
      "target_scope": "*",
      "applies_in": "",
      "source": "kb:cursor/terminal_default@2026-10-25"
    },
    {
      "id": "cap_b61c0c13f6fd0187",
      "kind": "capability",
      "type": "execute_shell",
      "basis": "configured",
      "in_force": true,
      "approval": "allow",
      "target_scope": "npx eslint *",
      "applies_in": "user",
      "source": "/home/dev/home/.claude/settings.json#/permissions/allow/2",
      "rule": "Bash(npx eslint *)"
    },
    {
      "id": "cap_bae7d9517edf8b13",
      "kind": "capability",
      "type": "network",
      "basis": "product_default",
      "in_force": true,
      "approval": "ask",
      "target_scope": "*",
      "applies_in": "",
      "source": "kb:cursor/network_default@2026-10-25"
    },
    {
      "id": "cap_c2399f2a846bd32a",
      "kind": "capability",
      "type": "write_files",
      "basis": "product_default",
      "in_force": true,
      "approval": "ask",
      "target_scope": "*",
      "applies_in": "",
      "source": "kb:claude-code/edit_default@2026-10-24"
    },
    {
      "id": "cap_d3478f2252e3db2f",
      "kind": "capability",
      "type": "execute_shell",
      "basis": "product_default",
      "in_force": true,
      "approval": "ask",
      "target_scope": "*",
      "applies_in": "",
      "source": "kb:claude-code/shell_default@2026-10-24"
    },
    {
      "id": "cap_e9f39b80a25c9391",
      "kind": "capability",
      "type": "invoke_mcp_tool",
      "basis": "product_default",
      "in_force": true,
      "approval": "ask",
      "target_scope": "*",
      "applies_in": "",
      "source": "kb:cursor/mcp_default@2026-10-25"
    },
    {
      "id": "cred_1ecec71a0748c2d4",
      "kind": "credential",
      "type": "api_key",
      "service": "supabase",
      "fingerprint": "hmac-sha256:8eeaa24e4007547a1ed7d66b8cdfea231e80d533ac0361471de9a940102ac38b",
      "locations": [
        "/home/dev/src/webapp/dashboard/.env.local:2"
      ],
      "discovered_at": "2026-10-25T10:26:25Z"
    },
    {
      "id": "cred_50d9e0decb16d50b",
      "kind": "credential",
      "type": "api_key",
      "service": "openai",
      "fingerprint": "hmac-sha256:3b1f40eb4e26fc26ce882eaa3ec066564464af4c871af642317485812ce06af2",
      "locations": [
        "/home/dev/src/notes/.env:1"
      ],
      "discovered_at": "2026-10-25T10:26:25Z"
    },
    {
      "id": "cred_6eb58dc5d65294e6",
      "kind": "credential",
      "type": "db_credential",
      "service": "unknown",
      "fingerprint": "hmac-sha256:93cff86fdb1be3fb3f132e4370b59d56d9a9f0a46454aee6de13a5663c0ab446",
      "locations": [
        "/home/dev/src/api-backend/.env.example:2"
      ],
      "discovered_at": "2026-10-25T10:26:25Z"
    },
    {
      "id": "cred_f1371ab311fb3983",
      "kind": "credential",
      "type": "api_key",
      "service": "supabase",
      "fingerprint": "hmac-sha256:115db7df4c117168cee5bb8b66086b79bd5638651c68d20cab19e80a38d5fdf6",
      "locations": [
        "/home/dev/src/webapp/dashboard/.env.local:3"
      ],
      "discovered_at": "2026-10-25T10:26:25Z"
    },
    {
      "id": "res_agent_config_43809e4f7e4aeab6",
      "kind": "resource",
      "type": "agent_config",
      "path": "/home/dev/home/.cursor/permissions.json",
      "discovered_at": "2026-10-25T10:26:25Z",
      "configures": "agent_client_764a08829c0ea77d"
    },
    {
      "id": "res_agent_config_56e93053d578bfad",
      "kind": "resource",
      "type": "agent_config",
      "path": "/home/dev/home/.claude.json",
      "discovered_at": "2026-10-25T10:26:25Z",
      "configures": "agent_client_70ecc232d00b77a7"
    },
    {
      "id": "res_agent_config_c47a3b83d0d49a9f",
      "kind": "resource",
      "type": "agent_config",
      "path": "/home/dev/home/.claude/settings.json",
      "discovered_at": "2026-10-25T10:26:25Z",
      "configures": "agent_client_70ecc232d00b77a7"
    },
    {
      "id": "res_agent_instructions_5c6f0d11b47dddf8",